MovieId,Title,Tmdb_id,vote_average,vote_count,popularity,overview,,,,,,,,,,,,,,
1165,Abduction,436905,0,0,0.6,"Alex discovers that his mother has been abducted by aliens. Because of the evilness that he perceives in the world, Alex wants to be abducted too and follows the purple rabbit’s trail.",,,,,,,,,,,,,,
1165,Abduction,523558,8,1,0.6,"Going back to the places of crime scenes and urban legends, a Visual Bizarre Adventure in Daytime.",,,,,,,,,,,,,,
1165,Abduction,500949,0,0,0.6,"A group of men stage elaborate abductions for the purpose of raising awareness about aliens. When an abduction doesn't go according to plan, the group must decide how to deal with their mistake.",,,,,,,,,,,,,,
1165,Abduction,465044,0,0,0.6,"A horror comedy spoofing conspiracy theory moves, girl victim films, and Alien Grey abduction movies.  Melissa rescues a young woman from a mental hospital where no-one believes she is a victim of abduction by aliens. She and a colleague try to prevent the aliens from taking her but a government agent seems to be hot on her trail, and the Alien Greys and their powerful leader, The Hive Queen have no intention of being stopped. An outrageous mix of graphic horror and dark twisted humor.",,,,,,,,,,,,,,
1166,Absentia,74777,5.9,164,4.507,"Tricia's husband Daniel has been missing for seven years. Her younger sister Callie comes to live with her as the pressure mounts to finally declare him 'dead in absentia.' As Tricia sifts through the wreckage and tries to move on with her life, Callie finds herself drawn to an ominous tunnel near the house. As she begins to link it to other mysterious disappearances, it becomes clear that Daniel's presumed death might be anything but 'natural.' The ancient force at work in the tunnel might have set its sights on Callie and Tricia... and Daniel might be suffering a fate far worse than death in its grasp.",,,,,,,,,,,,,,
1167,The Adjustment Bureau,38050,6.6,2304,10.251,"A man glimpses the future Fate has planned for him – and chooses to fight for his own destiny. Battling the powerful Adjustment Bureau across, under and through the streets of New York, he risks his destined greatness to be with the only woman he's ever loved.",,,,,,,,,,,,,,
1168,The Adventures of Tintin,17578,6.8,2896,12.231,"Intrepid young reporter, Tintin, and his loyal dog, Snowy, are thrust into a world of high adventure when they discover a ship carrying an explosive secret. As Tintin is drawn into a centuries-old mystery, Ivan Ivanovitch Sakharine suspects him of stealing a priceless treasure. Tintin and Snowy, with the help of salty, cantankerous Captain Haddock and bumbling detectives, Thompson and Thomson, travel half the world, one step ahead of their enemies, as Tintin endeavors to find the Unicorn, a sunken ship that may hold a vast fortune, but also an ancient curse.",,,,,,,,,,,,,,
1169,Almighty Thor,63736,2.4,25,1.269,"When the demon god Loki destroys the fortress of Valhalla and steals the Hammer of Invincibility, only the young hero Thor can protect Earth from armageddon.",,,,,,,,,,,,,,
1170,Alps,81857,6.2,88,4.756,"A nurse, a paramedic, a gymnast and her coach offer a service for hire wherein they stand in for dead people by appointment, hired by relatives, friends or colleagues of the deceased, to assist with the grieving process.",,,,,,,,,,,,,,
1171,Amanda Knox: Murder on Trial in Italy,58105,6.1,43,2.452,"Based on the events surrounding the murder of British student Meredith Kercher.Hayden Panettiere (Heroes) and Marcia Gay Harden (Academy Award winner for Pollock) star in the Lifetime Original Movie Amanda Knox: Murder on Trial in Italy based on the international headline-grabbing story of the now infamous American exchange student accused by Italian authorities of brutally killing her roommate. Amanda Knox: Murder on Trial in Italy poses the question of whether Knox (Panettiere), the Seattle honors student accused of murdering her college roommate Meredith Kercher (Amanda Fernando Stevens) in 2007 with her boyfriend Raffaele Sollecito (Paolo Romio) and acquaintance Rudy Guede (Djirbi Kebe), actually committed the crime or was herself a victim.",,,,,,,,,,,,,,
1172,Angel Dog,83735,3.6,6,0.6,"This heart warming film is about a dog named Cooper who is the lone survivor of a terrible car accident. Jake, a family patriarch, loses his wife and children in the accident. Not being a dog person, Jake is angry and resentful toward the dog for even surviving. However, eventually Jake bonds with Cooper, and this bond ends up being the one thing that gets him out of bed in the morning, the one thing that helps him to go on living after such a tragic loss.",,,,,,,,,,,,,,
1173,Anonymous,61891,6.4,402,5.496,"Set against the backdrop of the succession of Queen Elizabeth I, and the Essex Rebellion against her, the story advances the theory that it was in fact Edward De Vere, Earl of Oxford who penned Shakespeare's plays.",,,,,,,,,,,,,,
1173,Anonymous,479882,8,1,0.6,"Two people look for each other in Venice: a labyrinth of streets, bridges and water canals.",,,,,,,,,,,,,,
1174,Another Earth,55420,6.7,762,6.418,"On the night of the discovery of a duplicate Earth in the Solar system, an ambitious young student and an accomplished composer cross paths in a tragic accident.",,,,,,,,,,,,,,
1175,Apartment 143,Not Available,Not Available,Not Available,Not Available,Not Available,,,,,,,,,,,,,,
1176,Apollo 18,50357,5,446,8.987,"Officially, Apollo 17 was the last manned mission to the moon. But a year later in 1973, three American astronauts were sent on a secret mission to the moon funded by the US Department of Defense. What you are about to see is the actual footage which the astronauts captured on that mission. While NASA denies it's authenticity, others say it's the real reason we've never gone back to the moon.",,,,,,,,,,,,,,
1177,The Artist,74643,7.4,1566,7.52,"Hollywood, 1927: As silent movie star George Valentin wonders if the arrival of talking pictures will cause him to fade into oblivion, he sparks with Peppy Miller, a young dancer set for a big break.",,,,,,,,,,,,,,
1177,The Artist,298706,0,0,0.6,"Prouvost employs the rhetoric of conventional forms of narration to blur boundaries between the viewers’ perception of the fictional narrative and the reality of the installation. The rhythm and pace of the editing in her films undermines any straightforward attributions of meaning while at the same time retaining an alluring and beguiling quality. Not to be perceived as a ‘set’ but rather a cacophony of film, painting, sculpture, text and sound, the physical elements in the installation of The Artist become the characters for the ‘film’ and the audience faced with so much information, (a dog barking, a voice calling, ‘to look here… no here!’, heavy blankets and paintings suspended from the ceiling dividing the space, a hand pointing at objects), become at once lost, emphatic and inherently part of the work.",,,,,,,,,,,,,,
1177,The Artist,370425,0,0,0.6,THE ARTIST  by David Shrigley,,,,,,,,,,,,,,
1178,Arthur Christmas,51052,6.7,547,15.879,"Each Christmas, Santa and his vast army of highly trained elves produce gifts and distribute them around the world in one night. However, when one of 600 million children to receive a gift from Santa on Christmas Eve is missed, it is deemed ‘acceptable’ to all but one – Arthur. Arthur Claus is Santa’s misfit son who executes an unauthorized rookie mission to get the last present half way around the globe before dawn on Christmas morning.",,,,,,,,,,,,,,
1179,Assassination Games,71677,6,139,6.605,"Brazil is a contract killer, willing to take any job if the price is right. Flint left the assassin game when a ruthless drug dealer’s brutal attack left his wife in a coma. When a contract is put out on the same coldblooded drug dealer, both Brazil and Flint want him dead – one for the money, the other for revenge. With crooked Interpol agents and vicious members of the criminal underworld hot on their trail, these two assassins reluctantly join forces to quickly take out their target before they themselves are terminated.",,,,,,,,,,,,,,
1180,Asylum: Blackout,Not Available,Not Available,Not Available,Not Available,Not Available,,,,,,,,,,,,,,
1181,Atlas Shrugged,Not Available,Not Available,Not Available,Not Available,Not Available,,,,,,,,,,,,,,
1182,Attack the Block,59678,6.4,1040,7.67,A teen gang in a grim South London housing estate must team up with the other residents to protect their neighbourhood from a terrifying alien invasion.,,,,,,,,,,,,,,
1183,The Awakening,77949,6.3,707,6.04,1921 England is overwhelmed by the loss and grief of World War I. Hoax exposer Florence Cathcart (Hall) visits a boarding school to explain sightings of a child ghost.,,,,,,,,,,,,,,
1183,The Awakening,509835,0,0,1.103,"A successful lawyer drives recklessly and runs down a young man. He wants to escape punishment, so decides to drive the boy to a hospital and try to negotiate a deal. Their trip becomes a real test for the lawyer's consciousness.",,,,,,,,,,,,,,
1183,The Awakening,398307,4,3,0.6,"A group of LA twenty-somethings are lured out of the city and out into the wilderness in search of a rave, a hot girl, and good times. Instead, they encounter an ancient evil; a demon capable of possessing humans. As the demon passes through the group, each becomes both killer and victim. As their numbers dwindle the question arises: can they stop this malevolent spirit from spreading or will his power be to great for them?",,,,,,,,,,,,,,
1184,Bad Teacher,52449,5.4,2524,8.425,"A lazy, incompetent middle school teacher who hates her job and her students is forced to return to her job to make enough money for a boob job after her rich fiancé dumps her.",,,,,,,,,,,,,,
1185,Battle: Los Angeles,44943,5.6,1878,9.025,"The Earth is attacked by unknown forces. As people everywhere watch the world's great cities fall, Los Angeles becomes the last stand for mankind in a battle no one expected. It's up to a Marine staff sergeant and his new platoon to draw a line in the sand as they take on an enemy unlike any they've ever encountered before.",,,,,,,,,,,,,,
1186,The Beaver,50780,6.3,411,4.134,"Suffering from a severe case of depression, toy company CEO Walter Black (Mel Gibson) begins using a beaver hand puppet to help him open up to his family. With his father seemingly going insane, adolescent son Porter (Anton Yelchin) pushes for his parents to get a divorce. Jodie Foster directs and co-stars as Walter's wife in this dark comedy that also features Riley Thomas Stewart and Jennifer Lawrence.",,,,,,,,,,,,,,
1187,Being Elmo: A Puppeteer's Journey,75301,7.4,80,3.924,"Beloved by children of all ages around the world, Elmo is an international icon. Few people know his creator, Kevin Clash, who dreamed of working with his idol, master puppeteer Jim Henson. Displaying his creativity and talent at a young age, Kevin ultimately found a home on Sesame Street. Narrated by Whoopi Goldberg, this documentary includes rare archival footage, interviews with Frank Oz, Rosie O’Donnell, Cheryl Henson, Joan Ganz Cooney and others and offers a behind-the-scenes look at Sesame Street and the Jim Henson Workshop.",,,,,,,,,,,,,,
1188,Bernie,92591,6.6,456,6.098,"In small-town Texas, affable and popular mortician Bernie Tiede strikes up a friendship with Marjorie Nugent, a wealthy widow well known for her sour attitude. When she becomes controlling and abusive, Bernie goes to great lengths to remove himself from her grasp.",,,,,,,,,,,,,,
1189,Best Player,60089,5.7,50,3.194,"Chris Sanders and Quincy are both involved in a video game called Black Hole""", and they both want to win the tournament with a $175,500 prize. Quincy then tries to sabotage Chris, but it all goes wrong, because Chris' mom Tracy thinks that Quincy is her Internet date. Quincy lies to Tracy on their first date saying that he is a Home Ec. teacher at Chris' school. Right before the tournament, Chris figures out that Quincy was lying about everything. So," Chris decides that she will ""destroy"" him at the tournament. Quincy ends up forfeiting the tournament to show that he is sincerely sorry. Tracy takes him back", and they go to Chris' prom. Chris decides to go with her love interest in the movie," Ash.""",,,,,,
1190,Beverly Hills Chihuahua,Not Available,Not Available,Not Available,Not Available,Not Available,,,,,,,,,,,,,,
1191,Beyond the Border,56481,5.6,10,1.947,"December 1942. Two young soldiers leave their posts at checkpoint 83 in North Värmland, Sweden and make their way through the ice cold winter night towards the Nazi-occupied Norwegian border. Sweden stands on the brink of invasion and they want to see the enemy everybody's talking about. But the adventure ends in disaster and soon thereafter Lieutenant Aron Stenström finds out that his brother Sven is one of the missing soldiers. With the odds stacked against him he is forced to go behind enemy lines on a secret rescue mission. Deep inside the Norwegian forests Aron realizes that a completely different kind of line must be crossed if they're to come out alive.",,,,,,,,,,,,,,
1192,The Big Year,73937,5.8,348,5.014,"Three fanatical bird-watchers spend an entire year competing to spot the highest number of species as El Nino sends an extraordinary variety of rare breeds flying up into the U.S., but they quickly discover that there are more important things than coming out on top of the competition",,,,,,,,,,,,,,
1193,Bitter Lake,321109,7.9,36,1.573,An experimental documentary that explores Saudi Arabia's relationship with the U.S. and the role this has played in the war in Afghanistan.,,,,,,,,,,,,,,
1193,Bitter Lake,246416,0,0,0.6,"After more than a decade of peace the proud and noble kingdom of Valanor is suddenly torn apart by a terrible civil war. After 12 years, when the dust settles and resources start to dwindle, the starving people of Valanor cry out for peace, forcing the leaders of Tier, Sinnah, Daneth and Osgard to lay down their arms and meet each other at the negotiation table.  As each province prepares an envoy to find a diplomatic solution at the Kingdom's only neutral ground, an ancient and dark organization plots its return. Unbeknownst to the leaders of the four warring provinces this old enemy will stop at nothing to crush any hope of lasting peace.  Can the four envoys put their old hatreds aside and forge a bond of trust? Or will those that crave the blood and terror of war get their way?  Whatever the outcome, the fate of Valanor will be decided... at Bitter Lake.",,,,,,,,,,,,,,
1194,Blitz,55846,6,676,8.631,"A tough, renegade cop is dispatched to take down a serial killer who has been targeting police officers.",,,,,,,,,,,,,,
1194,Blitz,466957,0,0,0.6,A father and son agree to a winner-take-all chess blitz in order to settle a bet.,,,,,,,,,,,,,,
1195,Blood Was Everywhere,298708,3,1,0.6,"The nightmare of the unsolved, random murder is brought to life: A faceless killer wreaks havoc on the lives of average people in a small Massachusetts town.",,,,,,,,,,,,,,
1196,Bloody Bloody Bible Camp,120771,5.1,14,4.892,"In 1977 a group of young, horny, out of control Christians are spending a fun filled weekend at the mountain lakeside Happy Day Bible Camp. One by one these youthful sinners pay a BLOODY penance for their misdeeds. Flash forward 7 years, when another youth group of Bible toters return, lead by Father Richard Cummings"" (Reggie Bannister)"," ""Sister Mary Chopper"," (Tim Sullivan) goes bloody murder after the camp - emphasis on CAMP - with stand out performances by folks like Gigi Bannister, Jessica Sonneborn, Troy Guthrie, Deborah Venegas, Jay Fields, and Jeff Dylan Graham. In the end, Bannister and Troup must face down the a transvestite serial killing nun in a fight to the death, and call upon the higher graces of the infamous Ron Jeremy as Jesus"" guide them through! A hilarious campy equal opportunity offensive film that will have you DIE laughing!""",,,,,,,,,,,,
1197,The Borrowers,80709,5.7,22,4.514,"Family adventure based on Mary Norton's classic children's books about a race of tiny people who live under the floorboards, resourcefully surviving by borrowing bits and pieces from the large residents who dwell above.  After being discovered by 'human beans', borrower Arrietty and her parents are forced to leave their home while attempting to evade the clutches of obsessive scientist Professor Mildeye.",,,,,,,,,,,,,,
1198,Branded,112090,4.7,93,4.231,"In a dystopian future, where corporate brands have created a disillusioned population, one man's effort to unlock the truth behind the conspiracy leads to an epic battle with hidden forces that control the world.",,,,,,,,,,,,,,
1198,Branded,476833,0,0,0.6,"In this post-apocalyptic-western, Alexander Dante has lived the past 10 years in exile for the killing of Edwin, his beloved brother. Then one day he's astounded to receive a letter, purportedly from Edwin. The letter states Edwin now lives in the distant village shown on the enclosed map. At first, Alexander dismisses the letter as a hoax but there's something about the letter that rings true. He treks through a hard and hostile land that at long last opens up into a tranquil village. There, he's stunned to confront the impossible: his brother is very much alive. Alexander is overjoyed to see his brother but he is tormented as he knows he has killed him. Now Alexander must root out the truth -- whatever the consequences.",,,,,,,,,,,,,,
1198,Branded,400441,0,0,0.6,"A young man named Brandon finds himself being overwhelmed and blinded by the monotonous routine of his life, which is leaded by brands. He has a consumerist nightmare.",,,,,,,,,,,,,,
1198,Branded,329001,0,0,0.6,"Sports is supposed to be the ultimate level playing field, but in the media and on Madison Avenue, sometimes looks matter more than accomplishments. This film explores the double standard placed on female athletes to be the best players on the field and the sexiest off of it. Through stories of the women who have faced and tackled this question including Mary Lou Retton, Chris Evert, Lolo Jones, and Gabby Reece, Branded"" explores the question: can women's sports ever gain an equal footing with their male counterparts or will sex appeal always override achievement?""",,,,,,,,,,,,,,
1199,Bridesmaids,55721,6.5,2450,11.677,"Annie's life is a mess. But when she finds out her lifetime best friend is engaged, she simply must serve as Lillian's maid of honor. Though lovelorn and broke, Annie bluffs her way through the expensive and bizarre rituals. With one chance to get it perfect, she’ll show Lillian and her bridesmaids just how far you’ll go for someone you love.",,,,,,,,,,,,,,
1199,Bridesmaids,230873,7.3,4,0.751,"Best girlfriends come together to share a special moment; a wedding day! But before the bride can walk down the aisle, competing maids of honor Jesse Jane and Kayden Kross square off in a set of time honored traditions. A feisty fitting that features a horny back room fling , a wild bachelorette party where the male strippers aren't safe from the overheated honeys and a bridal shower that ends with the girls in jail! Award winning director Robby D. showcases Digital Playground contract superstars Jesse Jane, Kayden Kross, and Stoya as the beautiful bridesmaids. With 7 steamy sex scenes that include naughty girls Brooklyn Lee, Vicki Chase and Alyssa Branch as the bride. Bridesmaids will excite you with fun, passion, and desire!",,,,,,,,,,,,,,
1200,BUTter,Not Available,Not Available,Not Available,Not Available,Not Available,,,,,,,,,,,,,,
1201,Catch .44,Not Available,Not Available,Not Available,Not Available,Not Available,,,,,,,,,,,,,,
1202,Carnage,72113,7.1,1261,7.964,"After 11-year-old Zachary Cowan strikes his classmate across the face with a stick after an argument, the victim's parents invite Zachary's parents to their Brooklyn apartment to deal with the incident in a civilized manner.",,,,,,,,,,,,,,
1202,Carnage,369491,6,2,0.6,Only the dead body remained.  A one-armed woman who has a ghastly past. She dyes the wasteland in blood in order to achieve revenge on the one-eyed man.,,,,,,,,,,,,,,
1203,Cedar Rapids,52067,6,176,5.136,A naive Midwesterner insurance salesman travels to a big-city convention in an effort to save the jobs of his co-workers.,,,,,,,,,,,,,,
1204,Chalet Girl,58232,6.4,321,5.479,"While working a job at an exclusive ski resort to support her Dad, Kim learns to snowboard and is so good at it that she enters a competition with a huge cash prize. She has to dig deep to overcome her fears, but her life gets more complicated through her spoken-for boss, Jonny.",,,,,,,,,,,,,,
1205,Children of the Corn: Genesis,70575,4.2,43,3.551,"Tim and Allie seek shelter in a remote desert compound after becoming lost and stranded. A strange Manson-like character, Preacher, reluctantly allows them inside with strict orders to be gone by morning and not wander where you are not invited.""""",,,,,,,,,,,,,,
1206,Children Who Chase Lost Voices,79707,7.2,228,8.653,"The film centers on Asuna, a young girl who spends her solitary days listening to the mysterious music emanating from the crystal radio she received from her late father as a memento. One day while walking home she is attacked by a fearsome monster and saved mysterious boy named Shun. However, Shun disappears and Asuna embarks on a journey of adventure to the land of Agartha with her teacher Mr. Morisaki to meet a Shun again. Through her journey she comes to know the cruelty and beauty of the world, as well as loss.",,,,,,,,,,,,,,
1207,Chinese Takeaway,Not Available,Not Available,Not Available,Not Available,Not Available,,,,,,,,,,,,,,
1208,Colombiana,62835,6.5,1188,7.253,"Zoe Saldana plays a young woman who, after witnessing her parents’ murder as a child in Bogota, grows up to be a stone-cold assassin. She works for her uncle as a hitman by day, but her personal time is spent engaging in vigilante murders that she hopes will lead her to her ultimate target: the mobster responsible for her parents' death.",,,,,,,,,,,,,,
1209,Conan the Barbarian (2011),Not Available,Not Available,Not Available,Not Available,Not Available,,,,,,,,,,,,,,
1209,Conan the Barbarian (2011),Not Available,Not Available,Not Available,Not Available,Not Available,,,,,,,,,,,,,,
1210,The Conspirator,60309,6.5,208,4.637,"Mary Surratt is the lone female charged as a co-conspirator in the assassination trial of Abraham Lincoln. As the whole nation turns against her, she is forced to rely on her reluctant lawyer to uncover the truth and save her life.",,,,,,,,,,,,,,
1211,Contagion,39538,6.3,1868,8.971,"As an epidemic of a lethal airborne virus - that kills within days - rapidly grows, the worldwide medical community races to find a cure and control the panic that spreads faster than the virus itself.",,,,,,,,,,,,,,
1212,Coriolanus,101173,6.1,191,6.756,"Caius Martius, aka Coriolanus, is an arrogant and fearsome general who has built a career on protecting Rome from its enemies. Pushed by his ambitious mother to seek the position of consul, Coriolanus is at odds with the masses and unpopular with certain colleagues. When a riot results in his expulsion from Rome, Coriolanus seeks out his sworn enemy, Tullus Aufidius. Together, the pair vow to destroy the great city.",,,,,,,,,,,,,,
1213,Country Strong,45272,6.2,114,5.004,"Soon after the rising young singer-songwriter Beau Williams gets involved with a fallen, emotionally unstable country star Kelly Canter, the pair embark on a career resurrection tour helmed by her husband/manager James and featuring a beauty queen-turned-singer Chiles Stanton. Between concerts, romantic entanglements and old demons threaten to derail them all.",,,,,,,,,,,,,,
1214,Courageous,72213,7,110,5.257,"As law enforcement officers, Adam Mitchell, Nathan Hayes, and their partners are confident and focused. They willingly stand up to the worst the streets have to offer. Yet at the end of the day, they face a challenge that none of them are truly prepared to tackle: fatherhood. They know that God desires to turn the hearts of fathers to their children, but their children are beginning to drift further and further away from them. When tragedy hits home, these men are left wrestling with their hopes, their fears, their faith, and their fathering. Can a new found urgency help these dads draw closer to God ... and to their children? COURAGEOUS is the fourth release of Sherwood Pictures, the movie making ministry of Sherwood Church in Albany, Georgia.",,,,,,,,,,,,,,
1215,Cowboys & Aliens,49849,5.5,2786,11.911,"A stranger stumbles into the desert town of Absolution with no memory of his past and a futuristic shackle around his wrist. With the help of mysterious beauty Ella and the iron-fisted Colonel Dolarhyde, he finds himself leading an unlikely posse of cowboys, outlaws, and Apache warriors against a common enemy from beyond this world in an epic showdown for survival.",,,,,,,,,,,,,,
1216,Crazy Stupid Love,Not Available,Not Available,Not Available,Not Available,Not Available,,,,,,,,,,,,,,
1217,The Crucible,308940,10,2,0.704,Richard Armitage stars in Yael Farber's powerful production of Arthur Miller's timeless witch hunt parable.,,,,,,,,,,,,,,
1218,A Dangerous Method,48231,6.3,919,7.259,"Seduced by the challenge of an impossible case, the driven Dr. Carl Jung takes the unbalanced yet beautiful Sabina Spielrein as his patient. Jung’s weapon is the method of his master, the renowned Sigmund Freud. Both men fall under Sabina’s spell.",,,,,,,,,,,,,,
1219,The Darkest Hour,71469,4.9,657,8.061,"In Moscow, five young people lead the charge against an alien race which has attacked Earth via our power supply.",,,,,,,,,,,,,,
