MovieId,Title,Tmdb_id,vote_average,vote_count,popularity,overview,,,,,,,,,,,,,,
1719,All Superheroes Must Die,86304,3.9,18,1.22,"Masked vigilantes Charge (Jason Trost), Cutthroat (Lucas Till), The Wall (Lee Valmassy), and Shadow (Sophie Merkley) are rendered powerless by their archenemy (James Remar) and are forced to complete a series of deadly tasks in order to save the lives of more than 100 innocent civilians. Should they fail or refuse to cooperate, the entire town will be destroyed. ~ Jason Buchanan, Rovi",,,,,,,,,,,,,,
1720,Amiche Da Morire,Not Available,Not Available,Not Available,Not Available,Not Available,,,,,,,,,,,,,,
1721,American Hustle,168672,6.8,3971,9.987,"A con man, Irving Rosenfeld, along with his seductive partner Sydney Prosser, is forced to work for a wild FBI agent, Richie DiMaso, who pushes them into a world of Jersey powerbrokers and mafia.",,,,,,,,,,,,,,
1722,American Idiot,Not Available,Not Available,Not Available,Not Available,Not Available,,,,,,,,,,,,,,
1723,Anchorman 2: The Legend Continues,109443,6.1,1250,8.014,"With the 70s behind him, San Diego's top rated newsman, Ron Burgundy, returns to take New York's first 24-hour news channel by storm.",,,,,,,,,,,,,,
1724,Another Me,252529,4.9,106,5.543,A teenager finds her perfect life upended when she's stalked by a mysterious doppelganger who has her eyes set on assuming her identity.,,,,,,,,,,,,,,
1725,Assault on Wall Street,184125,5.9,262,5.262,"Jim is an average New Yorker living a peaceful life with a well paying job and a loving family. Suddenly, everything changes when the economy crashes causing Jim to lose everything. Filled with anger and rage, Jim snaps and goes to extreme lengths to seek revenge for the life taken from him.",,,,,,,,,,,,,,
1726,August: Osage County,152737,6.9,748,7.328,"A look at the lives of the strong-willed women of the Weston family, whose paths have diverged until a family crisis brings them back to the Midwest house they grew up in, and to the dysfunctional woman who raised them.",,,,,,,,,,,,,,
1727,Austenland,156711,6.7,258,4.655,"Obsessed with the BBC production of Pride and Prejudice"""," a woman travels to a Jane Austen theme park in search for her perfect gentleman.""",,,,,,,,,,,,,
1728,Babysitter Massacre,248426,3,3,1.084,"A group of young women teamed together in their youth to run a babysitting business, when one of their friends died suddenly the group fell apart. Now years later they are all going their separate ways as college approaches, but on Halloween night someone is torturing and killing every member of the babysitter club...",,,,,,,,,,,,,,
1729,Bad Grandpa,Not Available,Not Available,Not Available,Not Available,Not Available,,,,,,,,,,,,,,
1730,Banshee Chapter,207769,5.6,125,4.587,"On the trail of a missing friend who had been experimenting with mind-altering drugs, a young journalist - aided by a rogue counter-culture writer, The Silence of The Lambs -- finds herself drawn into the dangerous world of top-secret government chemical research and the mystery of a disturbing radio signal of unknown origin. A fast-paced thriller blending fact and fiction, Banshee Chapter is based on real documents, actual test subject testimony, and uncovered secrets about covert programs run by the CIA.",,,,,,,,,,,,,,
1731,Bayonetta: Bloody Fate,242546,5.2,24,2.791,"Bayonetta: Bloody Fate follows the story of the witch Bayonetta, as she defeats the blood-thirsty Angels and tries to remember her past from before the time she awoke, 20 years ago. Along her side are a mysterious little girl who keeps calling her Mummy"""," a journalist that holds a personal grudge against Bayonetta and a unknown white-haired woman who seems to know more than she is willing to reveal about Bayonetta's time before her sleep.""",,,,,,,,,,,,,
1732,Beautiful Creatures,109491,5.7,1583,9.445,"Ethan Wate just wants to get to know Lena Duchannes better, but unbeknownst to him, Lena has strange powers.  As Lena's 16th birthday approaches she might decide her fate, to be good or evil.  A choice which will impact her relationship forever.",,,,,,,,,,,,,,
1733,Begin Again,198277,7.2,1822,8.259,A long lost music producer finds a singer-songwriter right about the moment he has given up all hope on life.,,,,,,,,,,,,,,
1734,Behind the Candelabra,119675,6.7,413,7.475,"Based on the autobiographical novel, the tempestuous 6-year relationship between Liberace and his (much younger) lover, Scott Thorson, is recounted.",,,,,,,,,,,,,,
1735,Belle,205601,7.2,360,7.546,"BELLE is inspired by the true story of Dido Elizabeth Belle, the illegitimate mixed race daughter of a Royal Navy Admiral. Raised by her aristocratic great-uncle Lord Mansfield and his wife, Belle's lineage affords her certain privileges, yet the color of her skin prevents her from fully participating in the traditions of her social standing. Left to wonder if she will ever find love, Belle falls for an idealistic young vicar's son bent on change who, with her help, shapes Lord Mansfield's role as Lord Chief Justice to end slavery in England",,,,,,,,,,,,,,
1736,The Bell Witch Haunting,220677,3.5,26,1.256,Based on true events. The Robertson County Sheriff's Department has released footage found on the bodies of the Sawyer family's cell phones and video cameras. What was first thought to be a murder-suicide is now believed to be the return of a centuries-old demon responsible for America's most famous paranormal event.,,,,,,,,,,,,,,
1737,The Best Offer,152742,7.8,1214,8.271,"Virgil Oldman is a world renowned antiques expert and auctioneer. An eccentric genius, he leads a solitary life, going to extreme lengths to keep his distance from the messiness of human relationships. When appointed by the beautiful but emotionally damaged Claire to oversee the valuation and sale of her family’s priceless art collection, Virgil allows himself to form an attachment to her – and soon he is engulfed by a passion which will rock his bland existence to the core.",,,,,,,,,,,,,,
1738,Big Ass Spider,Not Available,Not Available,Not Available,Not Available,Not Available,,,,,,,,,,,,,,
1739,Big Bad Wolves,171540,6.6,161,5.238,"A series of brutal murders puts the lives of three men on a collision course: The father of the latest victim now out for revenge, a vigilante police detective operating outside the boundaries of law, and the main suspect in the killings - a religious studies teacher arrested and released due to a police blunder.",,,,,,,,,,,,,,
1739,Big Bad Wolves,555442,0,0,2.456,"Amidst sweltering street corners and glittering Coney Island lights, four Brooklyn BFFs are changed forever by one, very bloody, night.",,,,,,,,,,,,,,
1740,The Big Wedding,87567,5.8,609,6.345,"To the amusement of their adult children and friends, long divorced couple Don and Ellie Griffin are once again forced to play the happy couple for the sake of their adopted son's wedding after his ultra conservative biological mother unexpectedly decides to fly halfway across the world to attend. With all of the wedding guests looking on, the Griffins are hilariously forced to confront their past, present and future - and hopefully avoid killing each other in the process.",,,,,,,,,,,,,,
1741,Birdemic 2: The Resurrection,188489,2.5,44,2.389,"A platoon of eagles and vultures attack Hollywood, California. Why did the eagles and vultures attack? Who will survive?",,,,,,,,,,,,,,
1742,The Bling Ring,96936,5.3,1826,7.312,"Inspired by actual events, a group of fame-obsessed teenagers use the Internet to track celebrities' whereabouts in order to rob their homes.",,,,,,,,,,,,,,
1742,The Bling Ring,116853,4.2,26,1.508,"At the center of one of Hollywood's most notorious burglary rings in 2009 was a group of average, middle-class teens from a quiet suburb. This is the behind-the-scenes story of how Nick, a shy, awkward boy, lured by the promise of popularity and acceptance, found himself following his glamorous, charismatic best friend Rachel into breaking into celebrities' houses and robbing them of millions of dollars in clothes and jewelry.",,,,,,,,,,,,,,
1743,Blood Punch,257117,6.6,47,3.933,"Milton, a college dropout, was only supposed to cook meth for one day. Broken out of rehab by a brash young woman and her trigger-happy (ex"") boyfriend and driven to a remote cabin the woods", Milton finds himself drawn into a dangerous love triangle gone haywire. The couple's deadpan half-truths spin around Milton like a song on repeat. They seem to read him like an open book, until a mysterious message opens his eyes to his cursed existence. With unlimited ammunition, any hunting tool they could desire, and an ever-growing body count," for what did Milton really sign up?""",,,,,,,,,
1744,Blood Slaughter Massacre,327370,4,1,0.6,"10 years ago, Officer James Fincher narrowly escaped being killed at the hands of a masked maniac. Now a Detective, a new string of murders has begun in Havenwood. Has the Ripper returned?",,,,,,,,,,,,,,
1745,Bloody Homecoming,223732,4.6,15,1.207,"Three years after a tragic accident leaves a student dead at the annual Homecoming dance, a group of senior friends anxious about the return of Homecoming Night to their sleepy Southern town find themselves visited by a deadly presence from their past in the dark and desolate halls of their very own high school.",,,,,,,,,,,,,,
1746,Blue Is the Warmest Color,152584,7.2,1963,4.672,"Adèle's life is changed when she meets Emma, a young woman with blue hair, who will allow her to discover desire, to assert herself as a woman and as an adult. In front of others, Adele grows, seeks herself, loses herself, finds herself.",,,,,,,,,,,,,,
1747,Blue Jasmine,160588,7,1704,9.924,"Jasmine French used to be on the top of the heap as a New York socialite, but now is returning to her estranged sister in San Francisco utterly ruined. As Jasmine struggles with her haunting memories of a privileged past bearing dark realities she ignored, she tries to recover in her present. Unfortunately, it all proves a losing battle as Jasmine's narcissistic hangups and their consequences begin to overwhelm her. In doing so, her old pretensions and new deceits begin to foul up everyone's lives, especially her own.",,,,,,,,,,,,,,
1748,Blue Ruin,188166,6.9,644,6.148,"When the quiet life of a beach bum is upended by dreadful news, he sets off for his childhood home to carry out an act of vengeance.",,,,,,,,,,,,,,
1749,Borgman,186929,6.8,132,4.04,"Borgman is the central character of this dark, malevolent fable. Is he a dream or a demon, a twisted allegory or an all-too-real embodiment of our fears? Borgman is a sinister arrival in the sealed-off streets of modern suburbia. His presence unleashes a crowing gallery of distortion around the careful façade constructed by an arrogant, comfortable couple, their three children and nanny.",,,,,,,,,,,,,,
1750,Brain Divided,216898,6.1,17,1.447,"Brain Divided is the story of an ordinary guy who meets a not-so-ordinary girl, but his brain cells can't agree on how to go about winning her over which leads to conflict and comedy!",,,,,,,,,,,,,,
1751,Bullet to the Head,70074,5.3,620,6.248,"After watching their respective partners die, a cop and a hitman form an alliance in order to bring down their common enemy.",,,,,,,,,,,,,,
1752,The Butler,132363,7.3,1568,10.253,"A look at the life of Cecil Gaines who served eight presidents as the White House's head butler from 1952 to 1986, and had a unique front-row seat as political and racial history was made.",,,,,,,,,,,,,,
1752,The Butler,316844,0,0,0.6,"When the phone rings, it could be your job on the line.",,,,,,,,,,,,,,
1753,Byzantium,102780,6.2,426,5.949,"Two mysterious women seek refuge in a run-down coastal resort. Clara meets lonely Noel, who provides shelter in his deserted guesthouse, Byzantium. Schoolgirl Eleanor befriends Frank and tells him their lethal secret. They were born 200 years ago and survive on human blood. As knowledge of their secret spreads, their past catches up on them with deathly consequence.",,,,,,,,,,,,,,
1754,The Call,158011,6.7,1629,7.775,"Jordan Turner is an experienced 911 operator but when she makes an error in judgment and a call ends badly, Jordan is rattled and unsure if she can continue. But when teenager Casey Welson is abducted in the back of a man's car and calls 911, Jordan is the one called upon to use all of her experience, insights and quick thinking to help Casey escape, and not just to save her, but to make sure the man is brought to justice.",,,,,,,,,,,,,,
1754,The Call,502318,0,0,0.6,"A courtroom in Milan is filled with people brought together by random selection. Long interviews lie ahead. Based on the interviews, some of them will be chosen for jury duty. However, The Call doesn’t focus on judicial proceedings, but rather considers people’s sense of justice through the conversations in the waiting room.",,,,,,,,,,,,,,
1755,Captain Phillips,109424,7.6,3470,9.803,"The true story of Captain Richard Phillips and the 2009 hijacking by Somali pirates of the US-flagged MV Maersk Alabama, the first American cargo ship to be hijacked in two hundred years.",,,,,,,,,,,,,,
1756,Carousel,216949,8,1,0.6,A carousel-esque pocket-movie set in a Florentine piazza.,,,,,,,,,,,,,,
1756,Carousel,416087,0,0,0.6,A man doles out a torrent of accumulated wisdom to a teen with unexpected results.,,,,,,,,,,,,,,
1756,Carousel,423199,0,0,0.6,"21/03/16 - Wirral, England",,,,,,,,,,,,,,
1757,Carrie,133805,5.8,2331,12.361,"A reimagining of the classic horror tale about Carrie White, a shy girl outcast by her peers and sheltered by her deeply religious mother, who unleashes telekinetic terror on her small town after being pushed too far at her senior prom.",,,,,,,,,,,,,,
1758,Cas and Dylan,Not Available,Not Available,Not Available,Not Available,Not Available,,,,,,,,,,,,,,
1759,CBGB,111479,6.4,61,3.176,CBGB looks at New York's dynamic punk rock scene through the lens of the ground-breaking Lower East Side club started by eccentric Hilly Kristal (Alan Rickman) in 1973 which launched thousands of bands.,,,,,,,,,,,,,,
1760,Chanthaly,220287,6.3,3,0.6,"A sickly young woman experiences visions of her dead mother. She struggles to determine if the apparition is simply a side effect of her daily medication, or her mother actually reaching out to her from beyond the grave.",,,,,,,,,,,,,,
1761,Chariot,252990,5.4,29,1.964,Seven strangers find themselves unwitting participants in a U.S. government evacuation program gone horribly wrong.,,,,,,,,,,,,,,
1762,Cheap Thrills,175291,6.5,199,4.559,"Recently fired and facing eviction, a new dad has his life turned upside down when he meets a wealthy couple who offer a path to financial security... but at a price.",,,,,,,,,,,,,,
1763,Clear History,133790,6.2,158,6.363,"Nathan Flomm, in order to avoid the humiliation of having missed out on a hugely successful business, assumes a new identity on Martha's Vineyard. He plots revenge when his former business partner moves to the same town.",,,,,,,,,,,,,,
1764,Cloudy with a Chance of Meatballs 2,109451,6.4,1431,12.509,"After the disastrous food storm in the first film, Flint and his friends are forced to leave the town. Flint accepts the invitation from his idol Chester V to join The Live Corp Company, which has been tasked to clean the island, and where the best inventors in the world create technologies for the betterment of mankind. When Flint discovers that his machine still operates and now creates mutant food beasts like living pickles, hungry tacodiles, shrimpanzees and apple pie-thons, he and his friends must return to save the world.",,,,,,,,,,,,,,
1765,Coherence,220289,7.3,1061,8.014,"On the night of an astronomical anomaly, eight friends at a dinner party experience a troubling chain of reality bending events.",,,,,,,,,,,,,,
1766,Cold Comes the Night,210047,5.5,120,5.244,A struggling motel owner and her daughter are taken hostage by a nearly blind career criminal to be his eyes as he attempts to retrieve his cash package from a crooked cop.,,,,,,,,,,,,,,
1767,The Colony,178809,5.2,585,7.316,"Forced underground by the next ice age, a struggling outpost of survivors must fight to preserve humanity against a threat even more savage than nature.",,,,,,,,,,,,,,
1768,Compulsion,368182,4,14,9.174,"Sadie, a young female novelist, and an enigmatic woman named Francesca, are enticed by an ex-lover to join him at his Italian villa for a weekend celebration being held to honor the release of Sadie's latest book. Once there, Sadie begins to fear his true intentions as she and Francesca become embroiled in a dangerous game of moral and sexual discovery.",,,,,,,,,,,,,,
1768,Compulsion,201847,4.6,51,3.843,"A strange and destructive relationship develops between a chef and her neighbor, a former child actress.",,,,,,,,,,,,,,
1768,Compulsion,515581,0,0,0.697,"To give in, the blood must flow.",,,,,,,,,,,,,,
1768,Compulsion,478147,0,0,0.6,"Awakening to the experience of his first romantic connection, Ian’s trust in girlfriend Kelly is thrown into doubt by rumour. As his emotions swing between aggression and tenderness, he feels compelled to react. A study in the vicissitudes and intensity of love in adolescence.",,,,,,,,,,,,,,
1769,Computer Chess,158743,6.4,51,1.997,"Set over the course of a weekend tournament for chess software programmers thirty-some years ago, COMPUTER CHESS transports viewers to a nostalgic moment when the contest between technology and the human spirit seemed a little more up for grabs. We get to know the eccentric geniuses possessed with the vision to teach a metal box to defeat man, literally, at his own game, laying the groundwork for artificial intelligence as we know it and will come to know it in the future.",,,,,,,,,,,,,,
1770,The Counselor,109091,5.1,958,6.149,A lawyer finds himself in far over his head when he attempts to get involved in drug trafficking.,,,,,,,,,,,,,,
1770,The Counselor,450387,0,0,0.6,"At a crisis center in late 1971, a freshly minted counselor on the late shift takes his first call: a suicidal teenager whose parents won't let her come home for Christmas. The call exposes truths about each that lead to a surprising conclusion.",,,,,,,,,,,,,,
1771,A Country Christmas,249033,5.1,4,0.739,"When Santa Claus loses his magical powers and becomes stranded in their barn, two children from a small farming community help him save Christmas before it's too late.",,,,,,,,,,,,,,
1772,The Croods,49519,6.8,3430,13.29,"The Croods is a prehistoric comedy adventure that follows the world's first family as they embark on a journey of a lifetime when the cave that has always shielded them from danger is destroyed. Traveling across a spectacular landscape, the Croods discover an incredible new world filled with fantastic creatures -- and their outlook is changed forever.",,,,,,,,,,,,,,
1773,Crush,183662,6,140,5.483,A secret admirer's crush on a high school athlete takes a fatal turn.,,,,,,,,,,,,,,
1773,Crush,435515,0,0,0.6,"The story of a romantic encounter in the not-so-normal life of a girl named Sandra. A love letter to the films of David Cronenberg and Wes Anderson, this dark comedy explores the themes of young love, obsession, and pleasure.",,,,,,,,,,,,,,
1773,Crush,449594,0,0,0.6,That awkward joy of first love.,,,,,,,,,,,,,,
1773,Crush,108283,0,0,0.6,"Prom Night in the South Bronx, Michael is in for the an evening of horror, hilarity and hope as he decides whether or not to man up and kick it"" to his high school Crush or ""punk out"" and let him walk into the sunset.""",,,,,,,,,,,,,,
1774,Cupcakes,223932,5.1,9,1.073,"A group of friends in a Tel Aviv suburb get together to watch Universong, a Eurovision-like television song contest. They gather to watch and are depressed by the lifelessness of the Israeli entry, a parody of many recent offerings, a flashy, grating song about amour."" Realizing that Anat is distraught over the crisis in her marriage", they decide to compose a song to cheer her up. As a lark, they enters their cellphone video of it in next year's contest," and it becomes Israel's entry.""",,,,,,,,,,,
1775,Dallas Buyers Club,152532,7.9,4313,12.231,"Loosely based on the true-life tale of Ron Woodroof, a drug-taking, women-loving, homophobic man who in 1986 was diagnosed with HIV/AIDS and given thirty days to live.",,,,,,,,,,,,,,
1776,Dark Skies,145135,6.1,912,6.618,"From the producers of Paranormal Activity, Insidious, and Sinister comes Dark Skies: a supernatural thriller that follows a young family living in the suburbs. As husband and wife Daniel and Lacey Barret witness an escalating series of disturbing events involving their family, their safe and peaceful home quickly unravels. When it becomes clear that the Barret family is being targeted by an unimaginably terrifying and deadly force, Daniel and Lacey take matters in their own hands to solve the mystery of what is after their family.",,,,,,,,,,,,,,
1777,Dead in Tombstone,151933,5.1,83,3.987,"An outlaw named Guerrero Hernandez is shot in the back and killed whilst attempting to free his half-brother from a small-town prison. Making a deal with the devil, Hernandez returns from the dead to take his revenge.",,,,,,,,,,,,,,
1778,Delivery Man,146239,6.2,770,6.104,An affable underachiever finds out he's fathered 533 children through anonymous donations to a fertility clinic 20 years ago. Now he must decide whether or not to come forward when 142 of them file a lawsuit to reveal his identity.,,,,,,,,,,,,,,
1779,Devil's Pass,Not Available,Not Available,Not Available,Not Available,Not Available,,,,,,,,,,,,,,
1780,The Dirties,159770,6,53,2.147,The line between reality and fiction starts to blur when two best friends start making a movie about getting revenge on bullies.,,,,,,,,,,,,,,
1781,Dom Hemingway,192134,5.8,282,4.815,"After spending 12 years in prison for keeping his mouth shut, notorious safe-cracker Dom Hemingway is back on the streets of London looking to collect what he's owed.",,,,,,,,,,,,,,
1782,Don Jon,138697,5.9,2426,11.438,"A New Jersey guy dedicated to his family, friends, and church, develops unrealistic expectations from watching porn and works to find happiness and intimacy with his potential true love.",,,,,,,,,,,,,,
1783,The Double,146015,6.6,489,5.811,An awkward office drone becomes increasingly unhinged after a charismatic and confident look-alike takes a job at his workplace and seduces the woman he desires.,,,,,,,,,,,,,,
1783,The Double,73499,5.9,300,4.161,"The mysterious murder of a US senator bearing the distinctive trademark of the legendary Soviet assassin 'Cassius', forces retired CIA operative, Paul Shepherson to team with rookie FBI agent, Ben Geary  to solve the crime. Having spent his career chasing Cassius, Shepherdson is convinced his nemesis is long dead, but is pushed to take on the case by his former supervisor, Tom Highland. Geary, who wrote his Master's thesis on Shepherdson's pursuit of the Soviet killer, is certain that Cassius has resurfaced.",,,,,,,,,,,,,,
1783,The Double,164502,4.7,11,0.734,"Funny comedy about a life of super-famous mega-star Igor Uspensky and his fight for Man of a Year"" title.""",,,,,,,,,,,,,,
1784,Dracula: The Dark Prince,218266,3.9,17,3.72,"In his search for the Lightbringer, Dracula crosses paths with a beautiful crusader named Alina who bears a remarkable resemblance to his murdered bride. One look at her and Dracula is immediately smitten. Could Alina be the reincarnation of his long-dead love? Dracula has Alina kidnapped and brought to his castle where the Beast must now try to win his Beauty's heart.",,,,,,,,,,,,,,
1785,Drinking Buddies,172533,6,488,5.798,"Weekend trips, office parties, late night conversations, drinking on the job, marriage pressure, biological clocks, holding eye contact a second too long… you know what makes the line between “friends” and “more than friends” really blurry? Beer.",,,,,,,,,,,,,,
1786,The East,87499,6.6,403,5.058,An operative for an elite private intelligence firm finds her priorities irrevocably changed after she is tasked with infiltrating an anarchist group known for executing covert attacks upon major corporations.,,,,,,,,,,,,,,
1787,Elysium,68724,6.4,4852,10.479,"In the year 2159, two classes of people exist: the very wealthy who live on a pristine man-made space station called Elysium, and the rest, who live on an overpopulated, ruined Earth. Secretary Rhodes (Jodie Foster), a hard line government ofﬁcial, will stop at nothing to enforce anti-immigration laws and preserve the luxurious lifestyle of the citizens of Elysium. That doesn’t stop the people of Earth from trying to get in, by any means they can. When unlucky Max (Matt Damon) is backed into a corner, he agrees to take on a daunting mission that, if successful, will not only save his life, but could bring equality to these polarized worlds.",,,,,,,,,,,,,,
1788,Ender's Game,80274,6.6,3182,12.495,"Based on the classic novel by Orson Scott Card, Ender's Game is the story of the Earth's most gifted children training to defend their homeplanet in the space wars of the future.",,,,,,,,,,,,,,
1789,Enemy,181886,6.9,2284,8.023,A mild-mannered college professor discovers a look-alike actor and delves into the other man's private affairs.,,,,,,,,,,,,,,
1789,Enemy,522815,0,0,0.6,"Shotru (English: Enemy) is a 2011 Bengali action film directed by Raj Chakraborty and starring Jeet, Supriyo Dutta and Nusrat Jahan, who gave her debut by this film. This film was produced by Ashok Dhanuka of Eskay Movies who also distributed it. The movie is a remake of the Tamil film Singam which starred Surya and ...",,,,,,,,,,,,,,
1790,Epic,116711,6.4,1499,10.334,A teenager finds herself transported to a deep forest setting where a battle between the forces of good and the forces of evil is taking place. She bands together with a rag-tag group characters in order to save their world -- and ours.,,,,,,,,,,,,,,
