MovieId,Title,Tmdb_id,vote_average,vote_count,popularity,overview,,,,,,,,,,,,,,
522,The Emoji Movie,378236,5.5,1191,9.945,"Gene, a multi-expressional emoji, sets out on a journey to become a normal emoji.",,,,,,,,,,,,,,
523,The Endless,430231,6.6,185,14.04,Two brothers return to the cult they fled from years ago to discover that the group's beliefs may be more sane than they once thought.,,,,,,,,,,,,,,
524,Everything, Everything,417678,7.2,2018,11.025,"A teenager who's lived a sheltered life because she's allergic to everything, falls for the boy who moves in next door.",,,,,,,,,,,,,
525,Extinction (2018),Not Available,Not Available,Not Available,Not Available,Not Available,,,,,,,,,,,,,,
525,Extinction (2018),Not Available,Not Available,Not Available,Not Available,Not Available,,,,,,,,,,,,,,
526,The Evil Within,444193,6.3,44,6.182,"The sadistic tale of a lonely, mentally handicapped boy who befriends his reflection in an antique mirror. This demonic creature orders him to go on a murderous rampage to kill the people he loves most.",,,,,,,,,,,,,,
527,A Fantastic Woman,429191,7.1,247,8.393,"Marina's life is thrown into turmoil following the death of her partner. Mourning the loss of the man she loved, she finds herself under intense scrutiny from those with no regard for her privacy.",,,,,,,,,,,,,,
528,Fat Camp,428888,6,5,2.953,"Fitness buff Hutch Daily is a foul-mouthed 27 year-old with the maturity of a pre-teen. After refusing to find employment or his own apartment, his mom gives him two choices: move to the homeless shelter or work at his uncle’s fat camp. Though he thinks fatties are disgusting, Hutch finds himself supervising an irreverent group of chunky boys, who ultimately help him grow up.",,,,,,,,,,,,,,
528,Fat Camp,509520,0,0,0.6,"Welcome to Fat Camp, where big isn't beautiful... it's sexy. Seth leaves home humiliated to find a titillating paradise and the chance to be normal.",,,,,,,,,,,,,,
529,Father Figures,354861,5.8,211,8.662,"Upon learning that their mother has been lying to them for years about their allegedly deceased father, two fraternal twin brothers hit the road in order to find him.",,,,,,,,,,,,,,
530,Ferdinand,364689,7.1,1086,16.341,"Ferdinand, a little bull, prefers sitting quietly under a cork tree just smelling the flowers versus jumping around, snorting, and butting heads with other bulls. As Ferdinand grows big and strong, his temperament remains mellow, but one day five men come to choose the biggest", fastest," roughest bull"" for the bullfights in Madrid and Ferdinand is mistakenly chosen.  Based on the classic 1936 children's book by Munro Leaf.""",,,,,,,,,,,,
531,The Story of Ferdinand,Not Available,Not Available,Not Available,Not Available,Not Available,,,,,,,,,,,,,,
532,First They Killed My Father,433247,7.5,197,7.498,A 5-year-old girl embarks on a harrowing quest for survival amid the sudden rise and terrifying reign of the Khmer Rouge in Cambodia.,,,,,,,,,,,,,,
533,Fist Fight,345922,6,606,9.957,"When one school teacher gets the other fired, he is challenged to an after-school fight.",,,,,,,,,,,,,,
534,The Florida Project,394117,7.4,879,15.839,"The story of a precocious six year-old and her ragtag group of friends whose summer break is filled with childhood wonder, possibility and a sense of adventure while the adults around them struggle with hard times.",,,,,,,,,,,,,,
535,The Foreigner,379149,6.7,901,17.11,Quan is a humble London businessman whose long-buried past erupts in a revenge-fueled vendetta when the only person left for him to love – his teenage daughter – dies in a senseless act of politically-motivated terrorism. His relentless search to find the terrorists leads to a cat-and-mouse conflict with a British government official whose own past may hold the clues to the identities of the elusive killers.,,,,,,,,,,,,,,
535,The Foreigner,142319,5.2,3,0.754,A Frenchman falls in love with a hot temper Bulgarian village girl. Following the call of his heart he starts looking for the village where she lives without knowing the character and the language of the people living there.,,,,,,,,,,,,,,
535,The Foreigner,268196,5,1,0.6,"A character searches, in Macau, for a friend who lived there fifteen years before. Assisted by the letters written to him by his friend, he will reconstitute his past steps, trying to find him.",,,,,,,,,,,,,,
535,The Foreigner,498424,0,0,0.6,"In 2011, a computer game tournament in Columbus, Ohio became a battle of two nations. The Foreigner takes you behind the scenes as four elite South Korean pro gamers annihilate the competition, and one American fights back. Witness the event that changed gaming forever.",,,,,,,,,,,,,,
535,The Foreigner,503947,0,0,0.6,"Inspired by real events, a journalist covering the aftermath of an air strike in the Middle East is taken captive by militants.",,,,,,,,,,,,,,
536,Free Fire,334521,6.3,463,8.402,"A crime drama set in 1970s Boston, about a gun sale which goes wrong.",,,,,,,,,,,,,,
537,Fullmetal Alchemist,426285,5.1,215,7.835,Two alchemist brothers go on a quest for the Philosopher's Stone after an attempt to revive their dead mother goes horribly wrong.,,,,,,,,,,,,,,
538,Geostorm,274855,5.8,1879,18.809,"After an unprecedented series of natural disasters threatened the planet, the world's leaders came together to create an intricate network of satellites to control the global climate and keep everyone safe. But now, something has gone wrong: the system built to protect Earth is attacking it, and it becomes a race against the clock to uncover the real threat before a worldwide geostorm wipes out everything and everyone along with it.",,,,,,,,,,,,,,
539,Get Out,419430,7.4,6933,21.884,"Chris and his girlfriend Rose go upstate to visit her parents for the weekend. At first, Chris reads the family's overly accommodating behavior as nervous attempts to deal with their daughter's interracial relationship, but as the weekend progresses, a series of increasingly disturbing discoveries lead him to a truth that he never could have imagined.",,,,,,,,,,,,,,
539,Get Out,130627,5.7,7,1.054,A doctor unrelentingly tries to convince a phobic guy to come out of his isolation room.,,,,,,,,,,,,,,
540,Gintama,432985,6.9,11,3.682,"In an era where aliens have invaded and taken over feudal Tokyo, a young samurai finds work however he can.",,,,,,,,,,,,,,
541,Girls Trip,417870,6.8,854,11.522,"Four girlfriends take a trip to New Orleans for an annual festival and, along the way, rediscover their wild sides and strengthen the bonds of sisterhood.",,,,,,,,,,,,,,
542,A Ghost Story,428449,6.9,719,10.895,"Recently deceased, a white-sheeted ghost returns to his suburban home to console his bereft wife, only to find that in his spectral state he has become unstuck in time, forced to watch passively as the life he knew and the woman he loves slowly slip away.",,,,,,,,,,,,,,
543,Ghost in the Shell,315837,5.9,4477,20.803,"In the near future, Major is the first of her kind: a human saved from a terrible crash, then cyber-enhanced to be a perfect soldier devoted to stopping the world's most dangerous criminals.",,,,,,,,,,,,,,
544,Gifted,400928,7.9,1671,11.301,"Frank, a single man raising his child prodigy niece Mary, is drawn into a custody battle with his mother.",,,,,,,,,,,,,,
544,Gifted,501767,7,1,0.645,"The rise and fall of the worlds first superhero, Guardian.",,,,,,,,,,,,,,
544,Gifted,314569,6,3,0.6,"When a man loses his job, he slowly descends into car theft and serial murder. A dark, unflinching look at the darkness of a soul on the edge.",,,,,,,,,,,,,,
545,The Glass Castle,336000,7,265,6.936,"A young girl is raised in a dysfunctional family constantly on the run from the FBI. Living in poverty, she comes of age guided by her drunkard, ingenious father who distracts her with magical stories to keep her mind off the family's dire state, and her selfish, nonconformist mother who has no intention of raising a family, along with her younger brother and sister, and her other older sister. Together, they fend for each other as they mature in an unorthodox journey that is their family life.",,,,,,,,,,,,,,
546,Going in Style,353070,6.6,1126,10.046,"Desperate to pay the bills and come through for their loved ones, three lifelong pals risk it all by embarking on a daring bid to knock off the very bank that absconded with their money.",,,,,,,,,,,,,,
547,Good Time,429200,7.1,609,10.676,"After a botched bank robbery lands his younger brother in prison, Connie Nikas embarks on a twisted odyssey through New York City's underworld to get his brother Nick out of jail.",,,,,,,,,,,,,,
548,Goodbye Christopher Robin,418680,7.1,290,12.713,The behind the scenes story of the life of A.A. Milne and the creation of the Winnie the Pooh stories inspired by his son Christopher Robin.,,,,,,,,,,,,,,
549,The Greatest Showman,316029,8,3851,33.857,"The story of American showman P.T. Barnum, founder of the circus that became the famous traveling Ringling Bros. and Barnum & Bailey Circus.",,,,,,,,,,,,,,
550,Guardians,354556,4.5,300,9.258,"During the Cold War, an organization called Patriot"" created a super-hero squad", which includes members of multiple soviet republics. For years, the heroes had to hide their identities," but in hard times they must show themselves again.""",,,,,,,,,,,
550,Guardians,455652,7,1,0.6,,,,,,,,,,,,,,,
550,Guardians,489610,0,0,0.6,Two men are thrown together as live-in guardians of a 200 year-old house in the East End of London. But they are not alone. And so instead of learning to live together they have to fight to live through the night.,,,,,,,,,,,,,,
551,Happy Death Day,440021,6.5,2340,13.707,A college student relives the day of her murder over and over again as she tries to discover her killer's identity.,,,,,,,,,,,,,,
552,Happy End,399031,6.4,108,7.62,A middle-class family living in Calais deal with a series of setbacks while paying little attention to the grim conditions in the refugee camps within a few miles of their home.,,,,,,,,,,,,,,
552,Happy End,554127,0,0,2.857,A female story from male perspective about two losers who invented an effective self-help method under the slogan Love to the Sky," Fuck to the Stars""", and find themselves in the whirlwind of sex, politics, religion, the media, the devastating power of the mind of celebrity culture," strip characters and court scandal.""",,,,,,,
552,Happy End,83573,6.5,5,0.6,"They are people who have important significance for each other, but are not honest with each other. They live in a shadow world of lies and half truths and just waiting for the truth to come forward so they can continue their lives in a new direction.",,,,,,,,,,,,,,
552,Happy End,399219,8.3,3,0.6,"A splendid chain of unlikely encounters. Hunters, a tractor driver, a disco boy, and a corpse.",,,,,,,,,,,,,,
553,Here Alone,390582,5.7,67,3.054,"After a terrible virus ravages human civilization, Ann finds herself living alone in a forest, foraging for supplies, and accompanied only by a radio that broadcasts a single transmission in French. Few animals even remain; the only survivors seem to be the roving hordes of infected creatures with a taste for human flesh. One fateful day, Ann crosses paths with two more survivors, Chris and Olivia. But after surviving on her own for so long, she struggles to relate to them and and their desire to settle down and start a new community.",,,,,,,,,,,,,,
554,Hey Arnold! The Jungle Movie,439058,7.8,49,6.577,"An upcoming two-hour American animated television film split into two parts. Based on Craig Bartlett's Hey Arnold! TV series, it will serve as a sequel to the series finale in which Arnold found his father's journal and read about the life of his scientist parents, including their first meeting, birthing him, and a map showing the route they took to the San Lorenzo before they disappeared.",,,,,,,,,,,,,,
555,Hey Arnold! The Movie,Not Available,Not Available,Not Available,Not Available,Not Available,,,,,,,,,,,,,,
556,The Hitman's Bodyguard,390043,6.7,2560,19.874,"The world's top bodyguard gets a new client, a hit man who must testify at the International Court of Justice. They must put their differences aside and work together to make it to the trial on time.",,,,,,,,,,,,,,
557,Highway Rat,Not Available,Not Available,Not Available,Not Available,Not Available,,,,,,,,,,,,,,
558,The Hollow Child,433419,5.4,18,4.049,"Samantha has lived her whole life in different foster homes. Now living in a small town, she never feels like she quite fits in, even with her own current foster family who might adopt her, or the boy who follows her around doing her classwork. So, it’s perhaps natural that she doesn’t know what to do with a curious tagalong little sister named Olivia. One day, Sam callously ditches Olivia, who wanders off into the woods on her own and disappears.",,,,,,,,,,,,,,
559,Hostiles,384680,6.6,765,14.072,A legendary Native American-hating Army captain nearing retirement in 1892 is given one last assignment: to escort a Cheyenne chief and his family through dangerous territory back to his Montana reservation.,,,,,,,,,,,,,,
559,Hostiles,336821,5,2,0.6,"To strengthen their couple on the verge of breaking up, Bastien and Elise set off for a hike in the woods. A few years later, Bastien has become cynical and dark. He has a relationship based on voyeurism and sadomasochism with a woman called Sarah. One night, by continually pushing their experiences farther, the young woman is shocked and decides to distance herself from her lover. She then tries to get rid of him but he ends up losing his temper and imposing her the narrative of his hike with Elise. At first perplexed as for the intentions of the man who holds her back, Sarah is gradually overwhelmed with awe when the story falls into madness and Elise and Bastien, lost in the middle of nowhere have to face a threat that is bigger than their faltering romance",,,,,,,,,,,,,,
560,iBoy,414190,6,598,8.769,"After an accident, Tom wakes from a coma to discover that fragments of his smart phone have been embedded in his head, and worse, that returning to normal teenage life is impossible because he has developed a strange set of super powers.",,,,,,,,,,,,,,
561,I Don't Feel at Home in This World Anymore,425591,6.6,491,7.57,"When a depressed woman is burglarized, she finds a new sense of purpose by tracking down the thieves alongside her obnoxious neighbor. But they soon find themselves dangerously out of their depth against a pack of degenerate criminals.",,,,,,,,,,,,,,
562,Ingrid Goes West,411741,6.5,355,7.435,"Ingrid becomes obsessed with a social network star named Taylor Sloane who seemingly has a perfect life. But when Ingrid decides to drop everything and move west to be Taylor's friend, her behaviour turns unsettling and dangerous.",,,,,,,,,,,,,,
563,It Comes at Night,418078,5.7,979,9.453,"Secure within a desolate home as an unnatural threat terrorizes the world, a man has established a tenuous domestic order with his wife and son, but this will soon be put to test when a desperate young family arrives seeking refuge.",,,,,,,,,,,,,,
564,I, Tonya,389015,7.6,2148,17.779,"Competitive ice skater Tonya Harding rises amongst the ranks at the U. S. Figure Skating Championships, but her future in the sport is thrown into doubt when her ex-husband intervenes.",,,,,,,,,,,,,
565,Jesus, Bro!,406181,0,0,2.392,An angry internet atheist has a near death experience and must deliver the news of Jesus to his devout internet followers.,,,,,,,,,,,,,
566,Kamen Rider Ã— Super Sentai: Chou Super Hero Taisen,Not Available,Not Available,Not Available,Not Available,Not Available,,,,,,,,,,,,,,
566,Kamen Rider Ã— Super Sentai: Chou Super Hero Taisen,Not Available,Not Available,Not Available,Not Available,Not Available,,,,,,,,,,,,,,
567,Kidnap,293768,6,713,11.78,A mother (in her Minivan) stops at nothing to recover her kidnapped son.,,,,,,,,,,,,,,
568,Killing Gunther,412547,4.8,112,6.132,"A group of eccentric assassins are fed up with Gunther, the world's greatest hitman, and decide to kill him – but their plan turns into a series of bungled encounters as Gunther seems to always be one step ahead.",,,,,,,,,,,,,,
569,The Killing of a Sacred Deer,399057,6.8,1054,12.596,"Dr. Steven Murphy is a renowned cardiovascular surgeon who presides over a spotless household with his wife and two children. Lurking at the margins of his idyllic suburban existence is Martin, a fatherless teen who insinuates himself into the doctor's life in gradually unsettling ways.",,,,,,,,,,,,,,
570,King Arthur: Legend of the Sword,274857,6.5,2872,16.087,"When the child Arthur’s father is murdered, Vortigern, Arthur’s uncle, seizes the crown. Robbed of his birthright and with no idea who he truly is, Arthur comes up the hard way in the back alleys of the city. But once he pulls the sword Excalibur from the stone, his life is turned upside down and he is forced to acknowledge his true legacy... whether he likes it or not.",,,,,,,,,,,,,,
571,Lady Bird,391713,7.3,2941,18.981,"A California high school student plans to escape from her family and small town by going to college in New York, much to the disapproval of wildly loving, deeply opinionated and strong-willed mother.",,,,,,,,,,,,,,
572,Lady Macbeth,410117,6.6,228,6.392,The passionate affair of a young woman trapped in a marriage of convenience unleashes a maelstrom of murder and mayhem on a country estate.,,,,,,,,,,,,,,
573,Last Flag Flying,419709,6.9,153,6.95,"Thirty years after serving together in the Vietnam War, Larry Doc"" Shepherd", Sal Nealon and the Rev. Richard Mueller reunite for a different type of mission: to bury Doc's son, a young Marine killed in Iraq. Forgoing burial at Arlington National Cemetery, Doc and his old buddies take the casket on a bittersweet trip up the coast to New Hampshire. Along the way," the three men find themselves reminiscing and coming to terms with the shared memories of a war that continues to shape their lives.""",,,,,,,,,,
574,The Layover,339404,5.1,294,13.96,"When their plane is rerouted due to a hurricane warning, two single female best friends find themselves competing for the same guy during an extended layover in St. Louis.",,,,,,,,,,,,,,
574,The Layover,476529,0,0,0.6,"After being delayed a day, a flight attendant hurries home to commemorate a meaningful anniversary.",,,,,,,,,,,,,,
575,Let There Be Light,480881,6.5,15,3.073,An atheist goes through a near-death experience in an auto accident before converting to Christianity.,,,,,,,,,,,,,,
575,Let There Be Light,438442,7.3,3,0.6,"Let There Be Light follows the story of dedicated scientists working to build a small sun on Earth, which would unleash perpetual, cheap, clean energy for mankind. After decades of failed attempts, a massive push is now underway to crack the holy grail of energy.",,,,,,,,,,,,,,
576,Life,395992,6.3,3538,16.504,"The six-member crew of the International Space Station is tasked with studying a sample from Mars that may be the first proof of extra-terrestrial life, which proves more intelligent than ever expected.",,,,,,,,,,,,,,
576,Life,300153,6,188,5.577,"In 1955, young photographer Dennis Stock develops a close bond with actor James Dean while shooting pictures of the rising Hollywood star.",,,,,,,,,,,,,,
577,Little Evil,346671,5.8,441,10.583,"Gary, who has just married Samantha, the woman of his dreams, discovers that her six-year-old son may be the Antichrist.",,,,,,,,,,,,,,
578,The Little Hours,411873,5.6,148,7.606,A young servant fleeing from his master takes refuge at a convent full of emotionally unstable nuns in the middle ages.,,,,,,,,,,,,,,
579,Logan Lucky,399170,6.6,1297,16.005,"Trying to reverse a family curse, brothers Jimmy and Clyde Logan set out to execute an elaborate robbery during the legendary Coca-Cola 600 race at the Charlotte Motor Speedway.",,,,,,,,,,,,,,
580,The Lost City of Z,314095,6.2,1198,10.456,"A true-life drama in the 1920s, centering on British explorer Col. Percy Fawcett, who discovered evidence of a previously unknown, advanced civilazation in the Amazon and disappeared whilst searching for it.",,,,,,,,,,,,,,
581,Loveless,429174,7.4,268,7.064,"Zhenya and Boris are going through a vicious divorce marked by resentment, frustration and recriminations. Already embarking on new lives, each with a new partner, they are impatient to start again, to turn the page – even if it means threatening to abandon their 12-year-old son Alyosha. Until, after witnessing one of their fights, Alyosha disappears...",,,,,,,,,,,,,,
581,Loveless,83725,4,2,0.663,About a commitment-phobic New York City bachelor in crisis.,,,,,,,,,,,,,,
582,Loving Vincent,339877,8.3,938,10.366,"The film brings the paintings of Vincent van Gogh to life to tell his remarkable story. Every one of the 65,000 frames of the film is an oil-painting hand-painted by 125 professional oil-painters who travelled from all across the world to the Loving Vincent studios in Poland and Greece to be a part of the production. As remarkable as Vincent’s brilliant paintings are his passionate and ill-fated life and mysterious death.",,,,,,,,,,,,,,
583,Lu Over the Wall,436120,7.5,18,2.697,The story takes place in a harbor town where a gloomy middle school student named Kai meets a mermaid named Lu.,,,,,,,,,,,,,,
584,Magical Girl Lyrical Nanoha Reflection,432057,0,0,0.6,"Magical Girl Lyrical Nanoha Reflection (魔法少女リリカルなのはReflection) is the third theatrical anime film in the MGLN franchise. Unlike the previous two films, it will not adapt an existing story (such as StrikerS) but instead feature an original storyline,[2] taking some cue from the plot of The Battle of Aces and The Gears of Destiny but adding original storylines and characters, as well. It is the first part of a two-part story, with the second part titled Magical Girl Lyrical Nanoha Detonation.",,,,,,,,,,,,,,
585,The Mansion,437739,5.1,197,7.873,"A band of students comes to celebrate the New Year in an old manor house isolated from everything. But soon after their arrival, strange events disrupt the atmosphere, before the party turns squarely to the nightmare ...",,,,,,,,,,,,,,
586,The Man Who Invented Christmas,450322,6.3,195,11.523,"In 1843, Dickens was a literary rock star, but struggling financially after the slow sales of his previous novel, Martin Chuzzlewit. Seized with the vision of a story that would fire the hearts of humanity, Dickens pitched his publishers A Christmas Carol, but they passed. Desperate, Dickens declared he would publish it himself. Slipping into the world of his novel, he spent the next six weeks laughing and arguing with his characters, acting out scenes like a madman on the streets of London for hours on end.  With a powerful performance from Dan Stevens, THE MAN WHO INVENTED CHRISTMAS is a film for all ages about the most iconic Christmas story ever written and the genius behind it. The film also stars Christopher Plummer (The Sound of Music) as Ebenezer Scrooge and Jonathan Pryce (Game of Thrones) as John Dickens.",,,,,,,,,,,,,,
587,The Man with the Iron Heart,339259,6.4,223,9.7,"With the Third Reich is at his peak in 1942, the Czech resistance in London plans the most ambitious military operation of WWII –  Anthropoid. Two young recruits are sent to Prague to assassinate the most ruthless Nazi leader – Reinhardt Heydrich – head of the SS, the Gestapo and the architect of the Final Solution.",,,,,,,,,,,,,,
588,Marjorie Prime,426254,6,68,6.516,A service which creates holographic projections of late family members allows an elderly woman to spend time with a younger version of her deceased husband.,,,,,,,,,,,,,,
589,Mary and The Witch's Flower,Not Available,Not Available,Not Available,Not Available,Not Available,,,,,,,,,,,,,,
590,Mayhem,429733,6.4,183,12.71,A virus spreads through an office complex causing white collar workers to act out their worst impulses.,,,,,,,,,,,,,,
591,The Meyerowitz Stories,Not Available,Not Available,Not Available,Not Available,Not Available,,,,,,,,,,,,,,
592,Michael Bolton's Big, Sexy Valentine's Day Special,430780,7.2,19,4.763,"After Santa tells Michael Bolton that he needs 75,000 new babies by Christmas to meet toy supply, Michael Bolton hosts a sexy telethon to get the world to star making love.",,,,,,,,,,,,,
593,Molly's Game,396371,7.1,1329,16.59,"Molly Bloom, a young skier and former Olympic hopeful becomes a successful entrepreneur (and a target of an FBI investigation) when she establishes a high-stakes, international poker game.",,,,,,,,,,,,,,
594,Mother,Not Available,Not Available,Not Available,Not Available,Not Available,,,,,,,,,,,,,,
595,Mudbound,414425,7.7,467,8.107,"In the post–World War II South, two families are pitted against a barbaric social hierarchy and an unrelenting landscape as they simultaneously fight the battle at home and the battle abroad.",,,,,,,,,,,,,,
596,The Mummy,282035,5.4,3853,15.032,"Though safely entombed in a crypt deep beneath the unforgiving desert, an ancient queen whose destiny was unjustly taken from her is awakened in our current day, bringing with her malevolence grown over millennia, and terrors that defy human comprehension.",,,,,,,,,,,,,,
597,Murder on the Orient Express,392044,6.7,4374,25.776,Genius Belgian detective Hercule Poirot investigates the murder of an American tycoon aboard the Orient Express train.,,,,,,,,,,,,,,
597,Murder on the Orient Express,468556,0,0,0.706,"The Japanese adaption of Agatha Christie's famous whodunit Murder on the Orient Express"".""",,,,,,,,,,,,,,
598,My Friend Dahmer,445040,6.4,131,9.299,"Jeffrey Dahmer struggles with a difficult family life as a young boy. During his teenage years he slowly transforms, edging closer to the serial killer he becomes.",,,,,,,,,,,,,,
599,Noob: La CroisÃ©e des Destins,Not Available,Not Available,Not Available,Not Available,Not Available,,,,,,,,,,,,,,
